{
  "user_id": 12345,
  "user_name": "John Doe",
  "similarity": 0.23571285605430603,
  "ats_score": {
    "ats_score": 72.5,
    "detailed_scores": {
      "skills_match": 80.0,
      "experience_relevance": 65.0,
      "education_relevance": 90,
      "overall_formatting": 100
    },
    "feedback": {
      "strengths": [
        "Strong skills match",
        "Strong education relevance",
        "Strong overall formatting"
      ],
      "improvements": []
    },
    "detailed_feedback": {
      "skills_match": {
        "matching_elements": ["Python"],
        "missing_elements": ["Django", "REST APIs"],
        "explanation": "The candidate possesses Python skills, which is a core requirement. However, the job description specifically mentions Django and REST APIs, which are missing from the provided skill set. While other skills like C/C++, Machine Learning, Cloud technologies, and databases are valuable, they are not directly relevant to the core requirements of this specific job description. Therefore, the score reflects the presence of Python but the absence of Django and REST APIs."
      },
      "experience_relevance": {
        "matching_elements": [
          "Experience with Python (through development of speech-to-text system and MNIST classification).",
          "Experience with NLP models (BERTsum, PEGASUS, BART), indicating potential for understanding API interactions and data processing."
        ],
        "missing_elements": [
          "Explicit mention of Django experience.",
          "Explicit mention of REST API experience.",
          "Experience building web applications."
        ],
        "explanation": "The work experience demonstrates proficiency in Python and familiarity with NLP, which are valuable skills for a software engineer role. The intern developed a speech-to-text summarization system and a handwritten digit classification system, showcasing practical application of Python and machine learning concepts. However, the experience lacks explicit mention of Django and REST APIs, which are key requirements of the job description. The role is an internship and therefore the duration is relatively short (4 months). The experience is relevant but not a perfect match."
      },
      "education_relevance": {
        "matching_elements": [
          "Strong GPA: 8.46",
          "MTECH (Integrated) in Computer Science and Engineering from Vellore Institute of Technology (VIT), Vellore, India"
        ],
        "missing_elements": [],
        "explanation": "Education assessment completed"
      },
      "overall_formatting": {
        "matching_elements": ["name", "email", "phone"],
        "missing_elements": [],
        "explanation": "Format assessment completed"
      }
    }
  },
  "structured_data": {
    "name": "Harish KB",
    "email": "harishkb20205@gmail.com",
    "phone": "8248052926",
    "skills": [
      "Python",
      "Java",
      "C/C++",
      "Supervised learning",
      "Unsupervised learning",
      "NLP",
      "LLMs",
      "GitHub",
      "Docker",
      "Linux",
      "AWS",
      "Hugging Face",
      "OpenCV",
      "YOLO",
      "FastAPI",
      "Flask",
      "MongoDB",
      "Firebase"
    ],
    "experience": [
      {
        "title": "AI Research and Development Intern (Remote)",
        "company": "eBramha Techworks Private Limited",
        "start_date": "Jun 2024",
        "end_date": "Oct 2024",
        "description": "- Developed a speech-to-text summarization system integrating Whisper for transcription and Pegasus for summarization, enhancing processing speed and efficiency while significantly reducing overall processing time and improving system performance.\n- Conducted in-depth research on advanced NLP models such as PEGASUS, BERTsum and BART, contributing to the development of effective solutions for tasks like summarization and language understanding.\n- Built a neural network for handwritten digit classification (MNIST) from scratch, implementing core machine learning concepts like gradient descent and one-hot encoding."
      }
    ],
    "education": [
      {
        "institution": "Vellore Institute of Technology (VIT), Vellore, India",
        "degree": "MTECH (Integrated) in Computer Science and Engineering",
        "start_date": "Aug 2022",
        "end_date": "July 2027",
        "gpa": "8.46"
      }
    ],
    "certifications": [
      "Coursera: Supervised Machine Learning: Regression and Classification",
      "Coursera: Advanced Learning Algorithms",
      "Coursera: Generative AI with Large Language Models"
    ],
    "areas_of_interest": [
      "Machine Learning and AI",
      "Full Stack Development",
      "Cloud Computing and DevOps Practices"
    ]
  },
  "markdown_format": "# Harish KB\n\n8248052926 | harishkb20205@gmail.com\n\n## Education\n\nVellore Institute of Technology (VIT), Vellore, India\nMTECH (Integrated) in Computer Science and Engineering (CGPA: 8.46)\nAug 2022 - July 2027\n\n## Experience\n\n**AI Research and Development Intern (Remote)**\neBramha Techworks Private Limited\nJun 2024 - Oct 2024\n\n*   Developed a speech-to-text summarization system integrating Whisper for transcription and Pegasus for summarization, enhancing processing speed and efficiency while significantly reducing overall processing time and improving system performance.\n*   Conducted in-depth research on advanced NLP models such as PEGASUS, BERTsum and BART, contributing to the development of effective solutions for tasks like summarization and language understanding.\n*   Built a neural network for handwritten digit classification (MNIST) from scratch, implementing core machine learning concepts like gradient descent and one-hot encoding.\n\n## Projects\n\n**VerbiSense: Interactive Document Retrieval System**\n\n*   Built the VerbiSense backend with FastAPI, optimizing document uploads, query processing, and API performance for real-time interactions with the React frontend.\n*   Integrated Retrieval-Augmented Generation (RAG) for improved document retrieval and response generation.\n*   Applied PyTorch models for advanced NLP tasks like semantic understanding and context-based querying.\n\n**Speech-to-Text Summarization**\n\n*   Developed a Python script that improved audio transcription accuracy by 30% and reduced post-processing time by 35%.\n*   Designed and implemented the frontend interface to provide a seamless, user-friendly experience for individuals interacting with the speech-to-text summarization system.\n\n## Technical Skills\n\n**Languages:** Python, Java, C/C++\n**Machine Learning:** Supervised learning, unsupervised learning, NLP, LLMs\n**Tools:** GitHub, Docker, Linux, AWS, Hugging Face\n**Computer Vision:** OpenCV, YOLO\n**Backend:** FastAPI, Flask, MongoDB, Firebase\n\n## Areas of Interest\n\n*   Machine Learning and AI\n*   Full Stack Development\n*   Cloud Computing and DevOps Practices\n\n## Certifications\n\n*   Coursera: Supervised Machine Learning: Regression and Classification\n*   Coursera: Advanced Learning Algorithms\n*   Coursera: Generative AI with Large Language Models."
}
